{
  "setId": "technocracy",
  "name": "Technocracy",
  "description": "The Technocracy set.",
  "version": 1,
  "starterPacks": 3,
  "pack": {
    "common": 8,
    "uncommon": 3,
    "rare": 1,
    "legendaryChance": 0.1
  },
  "art": {
    "theme": "technocracy",
    "symbol": "◈",
    "title": "TECHNOCRACY"
  }
}
